{
  "schema_version": "miskatonic.terminal-state-custody-receipt.v0.1",
  "custody_receipt_id": "custody-abstracted-qual-r1-pos-06",
  "custody_mode": "DETERMINISTIC_EVIDENCE_REPLAY",
  "source_experiment_id": "formal-discovery-01b-r1",
  "source_work_order": "WO-MATH-FORMAL-DISCOVERY-01B-R3",
  "source_execution_commit": "d421e48f5345b3f28493b2098b6dabaa3c4c41e0",
  "source_execution_tree": "de2faaf9be02dabca4993972d0423310e88ffbbe",
  "source_result_ref": "experiments/formal-discovery-01b-r1/result.json",
  "source_result_sha256": "49f70e4a700478f8a884b7a00b67540701d87f67ff6c32afaea67a39374f0881",
  "problem_id": "qual-r1-pos-06",
  "problem_digest": "9388aea7d5e217716c277be83cbc4bf9eea31be197468fd5110ebdd95a17d17b",
  "arm": "ABSTRACTED",
  "candidate_id": "macro_mul_one_add_zero",
  "candidate_enabled": true,
  "candidate_application_status": "APPLIED",
  "candidate_application_count": 5,
  "search_run_ref": "search-run-qual-r1-pos-06-1789250600445",
  "search_run_digest": "151e17dd3381a6221b71d7813ad691c94adef150df816bb8ee36ae707db19449",
  "original_search_receipt_ref": "experiments/formal-discovery-01b-r1/receipts/search-abstracted-qual-r1-pos-06.json",
  "original_search_receipt_digest": "100f88d0528f30e860e93bf0ffbede4146c3c03aa7b91b97e0df98fd0f66002e",
  "replay_search_run_ref": "search-run-qual-r1-pos-06-1789253615280",
  "replay_search_run_digest": "704147ae55e1c0ee33835ed7b67ab04295dd11dcd5b41b2163f1a6b7df506021",
  "terminal_state_id": "state-replay-abstracted-qual-r1-pos-06",
  "terminal_canonical_representation": "vf",
  "terminal_expression_digest": "c70d6cef7d4fc20aecb20ae557e7e26c84ad39d97ce91f386f34114cabaffff7",
  "source_recorded_terminal_digest": "c70d6cef7d4fc20aecb20ae557e7e26c84ad39d97ce91f386f34114cabaffff7",
  "terminal_digest_parity": true,
  "nodes_expanded": 29,
  "nodes_evaluated": 46,
  "branch_count": 45,
  "solved": true,
  "metric_parity": true,
  "application_parity": true,
  "implementation_digests": {
    "applicator": "04e4418028c480a2963242e678af5cf7070257d2b0f2f38b3a7016ee3c2c5360",
    "environment": "08546ee80e7765acd8a4300372e501f99e1a90d843bdf25c5a15a64b84b47f2f",
    "smt_control": "08546ee80e7765acd8a4300372e501f99e1a90d843bdf25c5a15a64b84b47f2f",
    "adjudicator": "a755644fd1f1b836ea6090231ea49617f49682102cf4c51eb0e942e6ef60d08e"
  },
  "replayed_at": "2026-09-12T22:53:35.411614+00:00",
  "authority": "NONE",
  "receipt_digest": "31a08f1da1962ec348ea3955c08a731d5fe1df8885bd969d9cc8c1598d732b6f",
  "replay_search_receipt_ref": "experiments/formal-discovery-01b-r3/receipts/search-replay-abstracted-qual-r1-pos-06.json",
  "replay_search_receipt_digest": "1ca6f052a24f362f881ab5bc9eced559d202e7321bcaf85bfbdb8a8528c060f8"
}