{
  "schema_version": "miskatonic.terminal-state-custody-receipt.v0.1",
  "custody_receipt_id": "custody-abstracted-qual-r1-pos-05",
  "custody_mode": "DETERMINISTIC_EVIDENCE_REPLAY",
  "source_experiment_id": "formal-discovery-01b-r1",
  "source_work_order": "WO-MATH-FORMAL-DISCOVERY-01B-R1",
  "source_execution_commit": "d421e48f5345b3f28493b2098b6dabaa3c4c41e0",
  "source_execution_tree": "de2faaf9be02dabca4993972d0423310e88ffbbe",
  "source_result_ref": "experiments/formal-discovery-01b-r1/result.json",
  "source_result_sha256": "49f70e4a700478f8a884b7a00b67540701d87f67ff6c32afaea67a39374f0881",
  "problem_id": "qual-r1-pos-05",
  "problem_digest": "5f694efce529bc67a51c4f82d9bb7eb5d4518e7b5afc40322d98829aa3aafa81",
  "arm": "ABSTRACTED",
  "candidate_id": "macro_mul_one_add_zero",
  "candidate_enabled": true,
  "candidate_application_status": "APPLIED",
  "candidate_application_count": 2,
  "search_run_ref": "search-run-qual-r1-pos-05-1789250600362",
  "search_run_digest": "47fe1eab66940a5b4dc06b7c3f18502e3302a543a0d0f5a059a206620bc92224",
  "original_search_receipt_ref": "experiments/formal-discovery-01b-r1/receipts/search-abstracted-qual-r1-pos-05.json",
  "original_search_receipt_digest": "2d7a054c6122f2559d34d4e9cd0f71d9bf74d60ef892cd6a8deb5a2a43d34077",
  "replay_search_run_ref": "search-run-qual-r1-pos-05-1789251808495",
  "replay_search_run_digest": "7f5f136c772e3a1fb47b5d216f52f329f3a51c2936ff1d195c24b4d6fae56f97",
  "terminal_state_id": "state-replay-abstracted-qual-r1-pos-05",
  "terminal_canonical_representation": "ve",
  "terminal_expression_digest": "4bd2c412ba70847f497a7adb5ccd527724bfd229fc9b24f755c32b270459464b",
  "source_recorded_terminal_digest": "4bd2c412ba70847f497a7adb5ccd527724bfd229fc9b24f755c32b270459464b",
  "terminal_digest_parity": true,
  "nodes_expanded": 5,
  "nodes_evaluated": 9,
  "branch_count": 8,
  "solved": true,
  "metric_parity": true,
  "application_parity": true,
  "implementation_digests": {
    "applicator": "04e4418028c480a2963242e678af5cf7070257d2b0f2f38b3a7016ee3c2c5360",
    "environment": "08546ee80e7765acd8a4300372e501f99e1a90d843bdf25c5a15a64b84b47f2f",
    "smt_control": "08546ee80e7765acd8a4300372e501f99e1a90d843bdf25c5a15a64b84b47f2f",
    "adjudicator": "a755644fd1f1b836ea6090231ea49617f49682102cf4c51eb0e942e6ef60d08e"
  },
  "replayed_at": "2026-09-12T22:23:28.523841+00:00",
  "authority": "NONE",
  "receipt_digest": "ba8b8b7d8721b0b7b65fee3b417e1c52f07da37189d6ad97a567b0d5874c4509"
}