{
  "schema_version": "miskatonic.terminal-state-custody-receipt.v0.1",
  "custody_receipt_id": "custody-abstracted-qual-r1-pos-01",
  "custody_mode": "DETERMINISTIC_EVIDENCE_REPLAY",
  "source_experiment_id": "formal-discovery-01b-r1",
  "source_work_order": "WO-MATH-FORMAL-DISCOVERY-01B-R3",
  "source_execution_commit": "d421e48f5345b3f28493b2098b6dabaa3c4c41e0",
  "source_execution_tree": "de2faaf9be02dabca4993972d0423310e88ffbbe",
  "source_result_ref": "experiments/formal-discovery-01b-r1/result.json",
  "source_result_sha256": "49f70e4a700478f8a884b7a00b67540701d87f67ff6c32afaea67a39374f0881",
  "problem_id": "qual-r1-pos-01",
  "problem_digest": "1dec19dae0add463821335af100ca45f3ffbb77541fd098a02ceff35abde2458",
  "arm": "ABSTRACTED",
  "candidate_id": "macro_mul_one_add_zero",
  "candidate_enabled": true,
  "candidate_application_status": "APPLIED",
  "candidate_application_count": 2,
  "search_run_ref": "search-run-qual-r1-pos-01-1789250599986",
  "search_run_digest": "bc5277a9207e4fed8eb0662879350afe90303e2051d91410486ef7632688e04d",
  "original_search_receipt_ref": "experiments/formal-discovery-01b-r1/receipts/search-abstracted-qual-r1-pos-01.json",
  "original_search_receipt_digest": "c7f591ca35ebf5435efcbbf70ebd1be059c21850cfc9dab285adf70c4ee8e0ce",
  "replay_search_run_ref": "search-run-qual-r1-pos-01-1789253615043",
  "replay_search_run_digest": "09c38c68601162b00893788aaedd72de9e8df876d24a9020336b8d81e7dbe7a5",
  "terminal_state_id": "state-replay-abstracted-qual-r1-pos-01",
  "terminal_canonical_representation": "va",
  "terminal_expression_digest": "198dea392afc21d070f8abfc7c06d11060f1b278e5d62501bd57f1159a72ebac",
  "source_recorded_terminal_digest": "198dea392afc21d070f8abfc7c06d11060f1b278e5d62501bd57f1159a72ebac",
  "terminal_digest_parity": true,
  "nodes_expanded": 5,
  "nodes_evaluated": 9,
  "branch_count": 8,
  "solved": true,
  "metric_parity": true,
  "application_parity": true,
  "implementation_digests": {
    "applicator": "04e4418028c480a2963242e678af5cf7070257d2b0f2f38b3a7016ee3c2c5360",
    "environment": "08546ee80e7765acd8a4300372e501f99e1a90d843bdf25c5a15a64b84b47f2f",
    "smt_control": "08546ee80e7765acd8a4300372e501f99e1a90d843bdf25c5a15a64b84b47f2f",
    "adjudicator": "a755644fd1f1b836ea6090231ea49617f49682102cf4c51eb0e942e6ef60d08e"
  },
  "replayed_at": "2026-09-12T22:53:35.072493+00:00",
  "authority": "NONE",
  "receipt_digest": "7ebbaa25e8022ecbd41fe670b6d979dd8ee753c1fcedd555cd7762400438824f",
  "replay_search_receipt_ref": "experiments/formal-discovery-01b-r3/receipts/search-replay-abstracted-qual-r1-pos-01.json",
  "replay_search_receipt_digest": "2b6df517cebafd8f575224104ac8257b4d9d781bb47da1ad064c2ca3b2828a01"
}