{
  "schema_version": "miskatonic.terminal-state-custody-receipt.v0.1",
  "custody_receipt_id": "custody-baseline-qual-r1-neg-01",
  "custody_mode": "DETERMINISTIC_EVIDENCE_REPLAY",
  "source_experiment_id": "formal-discovery-01b-r1",
  "source_work_order": "WO-MATH-FORMAL-DISCOVERY-01B-R1",
  "source_execution_commit": "d421e48f5345b3f28493b2098b6dabaa3c4c41e0",
  "source_execution_tree": "de2faaf9be02dabca4993972d0423310e88ffbbe",
  "source_result_ref": "experiments/formal-discovery-01b-r1/result.json",
  "source_result_sha256": "49f70e4a700478f8a884b7a00b67540701d87f67ff6c32afaea67a39374f0881",
  "problem_id": "qual-r1-neg-01",
  "problem_digest": "0d75812b06662e8b8d723407e3a995f91c8b3a3827ea0212c4c2c340435a798d",
  "arm": "BASELINE",
  "candidate_id": "macro_mul_one_add_zero",
  "candidate_enabled": false,
  "candidate_application_status": "DISABLED",
  "candidate_application_count": 0,
  "search_run_ref": "search-run-qual-r1-neg-01-1789250600968",
  "search_run_digest": "e86f45ecb2487c2ad4f62bb2c753fa167d348491804bb4437b4691c8870a0a72",
  "original_search_receipt_ref": "experiments/formal-discovery-01b-r1/receipts/search-baseline-qual-r1-neg-01.json",
  "original_search_receipt_digest": "73f08b7a050f65ca24514452755c169529d9904a35e78e13c00043ca553e051d",
  "replay_search_run_ref": "search-run-qual-r1-neg-01-1789251808938",
  "replay_search_run_digest": "1f12e5e52b9be7f0c62feed819a1f3463fe1e2de936ee244b4f1d0269854f1ba",
  "terminal_state_id": "state-replay-baseline-qual-r1-neg-01",
  "terminal_canonical_representation": "na",
  "terminal_expression_digest": "3d9fc4bde7ceef058d65b00186e79c1f14b42687b491644c303065135b644e18",
  "source_recorded_terminal_digest": "3d9fc4bde7ceef058d65b00186e79c1f14b42687b491644c303065135b644e18",
  "terminal_digest_parity": true,
  "nodes_expanded": 4,
  "nodes_evaluated": 5,
  "branch_count": 4,
  "solved": true,
  "metric_parity": true,
  "application_parity": true,
  "implementation_digests": {
    "applicator": "04e4418028c480a2963242e678af5cf7070257d2b0f2f38b3a7016ee3c2c5360",
    "environment": "08546ee80e7765acd8a4300372e501f99e1a90d843bdf25c5a15a64b84b47f2f",
    "smt_control": "08546ee80e7765acd8a4300372e501f99e1a90d843bdf25c5a15a64b84b47f2f",
    "adjudicator": "a755644fd1f1b836ea6090231ea49617f49682102cf4c51eb0e942e6ef60d08e"
  },
  "replayed_at": "2026-09-12T22:23:28.964040+00:00",
  "authority": "NONE",
  "receipt_digest": "db7881e32e7b7b4b5591c542a779947d0b0a4d75e3aaf98127a95f6f00f8dc43"
}