{
  "schema_version": "miskatonic.terminal-state-custody-receipt.v0.1",
  "custody_receipt_id": "custody-baseline-qual-r1-neg-03",
  "custody_mode": "DETERMINISTIC_EVIDENCE_REPLAY",
  "source_experiment_id": "formal-discovery-01b-r1",
  "source_work_order": "WO-MATH-FORMAL-DISCOVERY-01B-R1",
  "source_execution_commit": "d421e48f5345b3f28493b2098b6dabaa3c4c41e0",
  "source_execution_tree": "de2faaf9be02dabca4993972d0423310e88ffbbe",
  "source_result_ref": "experiments/formal-discovery-01b-r1/result.json",
  "source_result_sha256": "49f70e4a700478f8a884b7a00b67540701d87f67ff6c32afaea67a39374f0881",
  "problem_id": "qual-r1-neg-03",
  "problem_digest": "29919a47342aae56cb20659d102cbc841c3a67f21375c1da76b81f8c2c7d36ab",
  "arm": "BASELINE",
  "candidate_id": "macro_mul_one_add_zero",
  "candidate_enabled": false,
  "candidate_application_status": "DISABLED",
  "candidate_application_count": 0,
  "search_run_ref": "search-run-qual-r1-neg-03-1789250601129",
  "search_run_digest": "4dd9c751c1984743c5f7cde685d5f6dc9935f818d2ffe20f599f3cbb3002488e",
  "original_search_receipt_ref": "experiments/formal-discovery-01b-r1/receipts/search-baseline-qual-r1-neg-03.json",
  "original_search_receipt_digest": "e3843a9113ea6036d346bfa1c2be69170dcce32fa2195bad80299899a589848e",
  "replay_search_run_ref": "search-run-qual-r1-neg-03-1789251809011",
  "replay_search_run_digest": "ff7f3796d4af94e7d65b2cbd607310a876c0056022c104bf111e0bf8d37eb0c9",
  "terminal_state_id": "state-replay-baseline-qual-r1-neg-03",
  "terminal_canonical_representation": "nc",
  "terminal_expression_digest": "0be477336d3e1a8d45d820aa54755092e2ec5e0751ccdf93a8fa8fa1e10bd753",
  "source_recorded_terminal_digest": "0be477336d3e1a8d45d820aa54755092e2ec5e0751ccdf93a8fa8fa1e10bd753",
  "terminal_digest_parity": true,
  "nodes_expanded": 4,
  "nodes_evaluated": 5,
  "branch_count": 4,
  "solved": true,
  "metric_parity": true,
  "application_parity": true,
  "implementation_digests": {
    "applicator": "04e4418028c480a2963242e678af5cf7070257d2b0f2f38b3a7016ee3c2c5360",
    "environment": "08546ee80e7765acd8a4300372e501f99e1a90d843bdf25c5a15a64b84b47f2f",
    "smt_control": "08546ee80e7765acd8a4300372e501f99e1a90d843bdf25c5a15a64b84b47f2f",
    "adjudicator": "a755644fd1f1b836ea6090231ea49617f49682102cf4c51eb0e942e6ef60d08e"
  },
  "replayed_at": "2026-09-12T22:23:29.035812+00:00",
  "authority": "NONE",
  "receipt_digest": "8b839ce45dbbe849f82a2d2aa38cfc452c38f9a5830e7200e50b5941ec1e1633"
}