{
  "schema_version": "miskatonic.terminal-state-custody-receipt.v0.1",
  "custody_receipt_id": "custody-baseline-qual-r1-pos-06",
  "custody_mode": "DETERMINISTIC_EVIDENCE_REPLAY",
  "source_experiment_id": "formal-discovery-01b-r1",
  "source_work_order": "WO-MATH-FORMAL-DISCOVERY-01B-R3",
  "source_execution_commit": "d421e48f5345b3f28493b2098b6dabaa3c4c41e0",
  "source_execution_tree": "de2faaf9be02dabca4993972d0423310e88ffbbe",
  "source_result_ref": "experiments/formal-discovery-01b-r1/result.json",
  "source_result_sha256": "49f70e4a700478f8a884b7a00b67540701d87f67ff6c32afaea67a39374f0881",
  "problem_id": "qual-r1-pos-06",
  "problem_digest": "9388aea7d5e217716c277be83cbc4bf9eea31be197468fd5110ebdd95a17d17b",
  "arm": "BASELINE",
  "candidate_id": "macro_mul_one_add_zero",
  "candidate_enabled": false,
  "candidate_application_status": "DISABLED",
  "candidate_application_count": 0,
  "search_run_ref": "search-run-qual-r1-pos-06-1789250600438",
  "search_run_digest": "84738e79737f63969cd91c9aeabc40559f013bb262f0d87a6631ac79ede1404c",
  "original_search_receipt_ref": "experiments/formal-discovery-01b-r1/receipts/search-baseline-qual-r1-pos-06.json",
  "original_search_receipt_digest": "e2304b7249201a53064cb6e7bd5aab07e4ac671015784f7d727fc37e93ad704c",
  "replay_search_run_ref": "search-run-qual-r1-pos-06-1789253615273",
  "replay_search_run_digest": "edb822b7ab2ef2ffe22d22ed0e24121aea64b7defd3006ba26f5961669ad3e4d",
  "terminal_state_id": "state-replay-baseline-qual-r1-pos-06",
  "terminal_canonical_representation": "vf",
  "terminal_expression_digest": "c70d6cef7d4fc20aecb20ae557e7e26c84ad39d97ce91f386f34114cabaffff7",
  "source_recorded_terminal_digest": "c70d6cef7d4fc20aecb20ae557e7e26c84ad39d97ce91f386f34114cabaffff7",
  "terminal_digest_parity": true,
  "nodes_expanded": 42,
  "nodes_evaluated": 65,
  "branch_count": 64,
  "solved": true,
  "metric_parity": true,
  "application_parity": true,
  "implementation_digests": {
    "applicator": "04e4418028c480a2963242e678af5cf7070257d2b0f2f38b3a7016ee3c2c5360",
    "environment": "08546ee80e7765acd8a4300372e501f99e1a90d843bdf25c5a15a64b84b47f2f",
    "smt_control": "08546ee80e7765acd8a4300372e501f99e1a90d843bdf25c5a15a64b84b47f2f",
    "adjudicator": "a755644fd1f1b836ea6090231ea49617f49682102cf4c51eb0e942e6ef60d08e"
  },
  "replayed_at": "2026-09-12T22:53:35.405813+00:00",
  "authority": "NONE",
  "receipt_digest": "ffb00dc8e7ecea01954eb303324ff8e140b454392a935adaeea8e104e31021bc",
  "replay_search_receipt_ref": "experiments/formal-discovery-01b-r3/receipts/search-replay-baseline-qual-r1-pos-06.json",
  "replay_search_receipt_digest": "81189e5fbd0af46d511ac1aaaf6eaf4a7f443b2e1e98c63145020ba95bca50c5"
}